{
  "$schema": "../../project.schema.json",
  "miniprogramRoot": "./dist",
  "projectname": "starter-taro-vue",
  "description": "starter-taro-vue",
  "appid": "wx9d6b29dabbb43222",
  "setting": {
    "condition": true,
    "urlCheck": true,
    "checkSiteMap": true,
    "es6": false,
    "postcss": false,
    "minified": false,
    "minifyWXMLSetting": {
      "global": {
        "collapseWhitespace": true
      },
      "foobar.wxml": {
        "preserveLineBreaks": false
      }
    },
    "useCompilerPlugins": ["less"]
  },
  "libVersion": "widelyUsed",
  "compileType": "miniprogram",
  "watchOptions": {
    "ignore": []
  },
  "skeletonConfig": {
    "global": {},
    "pages": {
      "pages/index/index": {}
    }
  }
}
